{
  "skill": "nv_segment_ct",
  "model": "NVIDIA-Medtech/NV-Segment-CT (VISTA3D)",
  "model_repo": "https://huggingface.co/nvidia/NV-Segment-CT",
  "license": "NVIDIA Open Model License (commercial-friendly)",
  "input": {
    "path": "skills/nv-segment-ct/fixtures/spleen_03.nii.gz",
    "shape": [
      512,
      512,
      40
    ],
    "ndim": 3,
    "spacing": [
      0.738281,
      0.738281,
      5.0
    ],
    "ground_truth_path": null
  },
  "output": {
    "shape": [
      512,
      512,
      40
    ],
    "label_prompts_requested": [
      1,
      3,
      5,
      14
    ],
    "label_ids_present": [
      1,
      3,
      5,
      14
    ],
    "unexpected_label_ids": [],
    "label_set_valid": true,
    "class_counts": {
      "label_id_1": 456974,
      "label_id_3": 60161,
      "label_id_5": 51177,
      "label_id_14": 49652
    },
    "voxel_volume_ml": 0.00272529,
    "class_volumes_ml": {
      "label_id_1": 1245.3886,
      "label_id_3": 163.9564,
      "label_id_5": 139.4724,
      "label_id_14": 135.3163
    },
    "any_label_present": true,
    "geometry": {
      "input_shape": [
        512,
        512,
        40
      ],
      "output_shape": [
        512,
        512,
        40
      ],
      "shape_match": true,
      "input_spacing": [
        0.738281,
        0.738281,
        5.0
      ],
      "output_spacing": [
        0.738281,
        0.738281,
        5.0
      ],
      "spacing_match": true,
      "affine_max_abs_diff": 0.0,
      "affine_match": true
    },
    "path": "skills/nv-segment-ct/fixtures/spleen_03_vista3d_out/spleen_03/spleen_03_seg.nii.gz"
  },
  "invocation": {
    "official_helper": "hugging_face_pipeline.HuggingFacePipelineHelper",
    "pipeline_name": "vista3d",
    "weights_dir": "skills/nv-segment-ct/bundle/vista3d_pretrained_model"
  },
  "runtime": {
    "model_load_seconds": 0.79,
    "inference_seconds": 29.868,
    "device": "cpu"
  },
  "intended_use_disclaimer": "Engineering verification only. Output is NOT clinically meaningful. This wrapper invokes the official HuggingFace pipeline from the nvidia/NV-Segment-CT model card; it does not modify inference."
}